{
  "$schema": "https://json-schema.org/draft/2020-12/schema",
  "$id": "https://ai-workflow-playbook.local/schemas/evidence_bundle.schema.json",
  "title": "EvidenceBundle",
  "type": "object",
  "required": [
    "schema_version",
    "bundle_id",
    "manifest_hash",
    "repository",
    "task_id",
    "commit_before",
    "commit_after",
    "task_spec_version",
    "condition",
    "adapter_version",
    "environment_digest",
    "command_receipts",
    "trace_refs",
    "post_state_manifest",
    "scorer_outputs",
    "failure_records",
    "cost_record",
    "generated_report_ref",
    "verifier_identity",
    "verification_timestamp"
  ],
  "additionalProperties": false,
  "properties": {
    "schema_version": { "type": "string", "const": "playbook.evidence_bundle.v1" },
    "bundle_id": { "type": "string", "minLength": 1 },
    "manifest_hash": { "type": "string", "pattern": "^[a-f0-9]{64}$" },
    "repository": { "type": "string", "minLength": 1 },
    "task_id": { "type": "string", "minLength": 1 },
    "commit_before": { "type": "string", "minLength": 1 },
    "commit_after": { "type": "string", "minLength": 1 },
    "task_spec_version": { "type": "string", "minLength": 1 },
    "condition": { "type": "string", "minLength": 1 },
    "adapter_version": { "type": "string", "minLength": 1 },
    "environment_digest": { "type": "string", "minLength": 1 },
    "prompt_ref": { "$ref": "#/$defs/artifact_ref" },
    "command_receipts": {
      "type": "array",
      "items": { "$ref": "#/$defs/artifact_ref" }
    },
    "trace_refs": {
      "type": "array",
      "items": { "$ref": "#/$defs/artifact_ref" }
    },
    "post_state_manifest": { "$ref": "#/$defs/artifact_ref" },
    "scorer_outputs": {
      "type": "array",
      "items": { "$ref": "#/$defs/artifact_ref" }
    },
    "failure_records": {
      "type": "array",
      "items": {
        "oneOf": [
          { "$ref": "#/$defs/artifact_ref" },
          { "type": "object" }
        ]
      }
    },
    "cost_record": {
      "oneOf": [
        { "$ref": "#/$defs/artifact_ref" },
        { "type": "object" },
        { "type": "null" }
      ]
    },
    "generated_report_ref": {
      "oneOf": [
        { "$ref": "#/$defs/artifact_ref" },
        { "type": "null" }
      ]
    },
    "harness_eval_unit_ref": { "$ref": "#/$defs/artifact_ref" },
    "verifier_identity": { "type": "string", "minLength": 1 },
    "verification_timestamp": { "type": "string", "minLength": 1 },
    "regression_thresholds": { "type": "object" }
  },
  "$defs": {
    "artifact_ref": {
      "type": "object",
      "required": ["path", "sha256"],
      "additionalProperties": false,
      "properties": {
        "path": { "type": "string", "minLength": 1 },
        "sha256": { "type": "string", "pattern": "^[a-f0-9]{64}$" },
        "kind": { "type": "string" },
        "id": { "type": "string" }
      }
    }
  }
}
